{
  "schema_version": "plamen.mechanical_gate_activation_inventory_candidate.provisional.v1",
  "status": "PROVISIONAL_UNWRAPPED_UNREVIEWED",
  "runtime_authority_granted": false,
  "authoritative_registry": {
    "path": "rules/mechanical-gate-registry.json",
    "sha256": "5acf9a848bae74ab256872600324098e1472bff73fdcb0233923f6c5dac5157e",
    "schema_version": "plamen.mechanical_gate_registry.v1"
  },
  "source_snapshot": {
    "source_tree_digest_algorithm": "sha256:plamen-source-tree-v1",
    "source_tree_digest": "605041aff4c9dc4cddf848af9fe71d7e7d5399487f9a89a7e2d624294489c9c6",
    "digest_stability": "REGENERATE_AT_TREE_FREEZE",
    "git_head": "67a0f85adc7a8169d79a286908b00bef7adb764a",
    "files": [
      {
        "path": "scripts/audit_snapshot.py",
        "sha256": "ea80ce08577f68eaad1d1b3c4d06c237d87e3a4d6db5fcda1435bb582561fe53"
      },
      {
        "path": "scripts/enumeration_gate.py",
        "sha256": "084b5604c8d48a1a321549bd987d66578a6cc86ce088402cd8162c92df14ec7c"
      },
      {
        "path": "scripts/mandatory_reverification.py",
        "sha256": "a786942c9efbd1e959969091f5ed5bb8def2246adcc042a7085f84de68690bad"
      },
      {
        "path": "scripts/mechanical_verify.py",
        "sha256": "c083898e011c7cb9a1f224edd3dda4b9fb40ec8f07465d355a64df7524418d2c"
      },
      {
        "path": "scripts/phase_io_contracts.py",
        "sha256": "ec4d4872f4f217a333fc0a5006b127a715b275bf69a402d9386f4a1ff662b9fd"
      },
      {
        "path": "scripts/plamen_driver.py",
        "sha256": "45aa2ebe92f85688e52f8886d6e75db17157d7d44bcbfa919cc4381ef51d3c69"
      },
      {
        "path": "scripts/plamen_mechanical.py",
        "sha256": "d24409338ef4d1a4c2a0b9e026b5f59f4521ec6ca8c2c56027e543e7c8abdf72"
      },
      {
        "path": "scripts/plamen_validators.py",
        "sha256": "20e4c437670d4e3c7575bcd5c360a59b96070870b7cc95e791901208c0fa7313"
      },
      {
        "path": "scripts/post_verify_lifecycle.py",
        "sha256": "fbc67412f5ca9a54c5d775bf2d4d2fb2db75985e5e1248e34e27827b7996142f"
      },
      {
        "path": "scripts/recon_prepass.py",
        "sha256": "86d1adca34a61c22fef34876b21573b854892ef1a7b98076890a3fa9037653c8"
      },
      {
        "path": "scripts/report_disposition_authority.py",
        "sha256": "46624f1f5f131d0e293c4421c4e3cebc14ccd486a671716ee4997f5052e6fbc2"
      },
      {
        "path": "scripts/supply_chain_gate.py",
        "sha256": "929c6aa88978907050a2b5e16e8d2c8a6037f15adf58a9d12ffd519b42bb420c"
      }
    ]
  },
  "independent_review_receipt_sha256": null,
  "gate_count": 33,
  "activation_count": 33,
  "activations": [
    {
      "forensic_id": "MG-001",
      "gate_id": "supply_chain.pre_input_execution",
      "activation_id": "supply_chain.pre_input_execution.recon_prepass",
      "owning_seam": "STARTUP_RESUME",
      "applicability": {
        "pipelines": [
          "L1",
          "SC"
        ],
        "modes": [
          "CORE",
          "LIGHT",
          "THOROUGH"
        ],
        "ecosystems": [
          "APTOS",
          "DAML",
          "EVM",
          "L1_GO",
          "L1_RUST",
          "SOLANA",
          "SOROBAN",
          "SUI"
        ],
        "backends": [
          "CLAUDE",
          "CODEX"
        ],
        "phase_contexts": [
          "RECON"
        ],
        "status": "RUNTIME_SELECTOR_REQUIRES_CUTOVER_BINDING"
      },
      "definitions": [
        {
          "module": "scripts/supply_chain_gate.py",
          "symbol": "gate_supply_chain",
          "source_line": 520
        }
      ],
      "observed_callsites": [
        {
          "module": "scripts/recon_prepass.py",
          "enclosing_symbol": "_prepare_evm_build",
          "call_symbol": "gate_supply_chain",
          "source_line": 2134
        }
      ],
      "wrapper_target": {
        "module": "scripts/recon_prepass.py",
        "symbol": "_prepare_evm_build",
        "strategy": "INLINE_AT_EXISTING_CALLSITE"
      },
      "literal_runtime_registration_present": false
    },
    {
      "forensic_id": "MG-002",
      "gate_id": "supply_chain.pre_poc_execution",
      "activation_id": "supply_chain.pre_poc_execution.mechanical_verify",
      "owning_seam": "POST_VERIFY",
      "applicability": {
        "pipelines": [
          "L1",
          "SC"
        ],
        "modes": [
          "CORE",
          "LIGHT",
          "THOROUGH"
        ],
        "ecosystems": [
          "APTOS",
          "DAML",
          "EVM",
          "L1_GO",
          "L1_RUST",
          "SOLANA",
          "SOROBAN",
          "SUI"
        ],
        "backends": [
          "CLAUDE",
          "CODEX"
        ],
        "phase_contexts": [
          "VERIFY"
        ],
        "status": "FORENSIC_EXACT"
      },
      "definitions": [
        {
          "module": "scripts/supply_chain_gate.py",
          "symbol": "gate_supply_chain",
          "source_line": 520
        }
      ],
      "observed_callsites": [
        {
          "module": "scripts/mechanical_verify.py",
          "enclosing_symbol": "run_phase5b_mechanical_verify",
          "call_symbol": "gate_supply_chain",
          "source_line": 2216
        }
      ],
      "wrapper_target": {
        "module": "scripts/mechanical_verify.py",
        "symbol": "run_phase5b_mechanical_verify",
        "strategy": "INLINE_AT_EXISTING_CALLSITE"
      },
      "literal_runtime_registration_present": false
    },
    {
      "forensic_id": "MG-003",
      "gate_id": "snapshot.startup_binding",
      "activation_id": "snapshot.startup_binding.driver",
      "owning_seam": "STARTUP_RESUME",
      "applicability": {
        "pipelines": [
          "L1",
          "SC"
        ],
        "modes": [
          "CORE",
          "LIGHT",
          "THOROUGH"
        ],
        "ecosystems": [
          "APTOS",
          "DAML",
          "EVM",
          "L1_GO",
          "L1_RUST",
          "SOLANA",
          "SOROBAN",
          "SUI"
        ],
        "backends": [
          "CLAUDE",
          "CODEX"
        ],
        "phase_contexts": [
          "STARTUP"
        ],
        "status": "FORENSIC_EXACT"
      },
      "definitions": [
        {
          "module": "scripts/audit_snapshot.py",
          "symbol": "snapshot_startup_guard",
          "source_line": 2969
        }
      ],
      "observed_callsites": [
        {
          "module": "scripts/plamen_driver.py",
          "enclosing_symbol": "main",
          "call_symbol": "snapshot_startup_guard",
          "source_line": 66850
        }
      ],
      "wrapper_target": {
        "module": "scripts/plamen_driver.py",
        "symbol": "main",
        "strategy": "INLINE_AT_EXISTING_CALLSITE"
      },
      "literal_runtime_registration_present": false
    },
    {
      "forensic_id": "MG-004",
      "gate_id": "snapshot.interphase_drift",
      "activation_id": "snapshot.interphase_drift.driver",
      "owning_seam": "STARTUP_RESUME",
      "applicability": {
        "pipelines": [
          "L1",
          "SC"
        ],
        "modes": [
          "CORE",
          "LIGHT",
          "THOROUGH"
        ],
        "ecosystems": [
          "APTOS",
          "DAML",
          "EVM",
          "L1_GO",
          "L1_RUST",
          "SOLANA",
          "SOROBAN",
          "SUI"
        ],
        "backends": [
          "CLAUDE",
          "CODEX"
        ],
        "phase_contexts": [
          "INTERPHASE",
          "STARTUP"
        ],
        "status": "RUNTIME_SELECTOR_REQUIRES_CUTOVER_BINDING"
      },
      "definitions": [
        {
          "module": "scripts/plamen_driver.py",
          "symbol": "_assert_audit_snapshot_still_bound",
          "source_line": 65256
        }
      ],
      "observed_callsites": [
        {
          "module": "scripts/plamen_driver.py",
          "enclosing_symbol": "_run_phase_validators",
          "call_symbol": "_assert_audit_snapshot_still_bound",
          "source_line": 61939
        },
        {
          "module": "scripts/plamen_driver.py",
          "enclosing_symbol": "main",
          "call_symbol": "_assert_audit_snapshot_still_bound",
          "source_line": 67325
        }
      ],
      "wrapper_target": {
        "module": "scripts/plamen_driver.py",
        "symbol": "_assert_audit_snapshot_still_bound",
        "strategy": "WRAP_EXISTING_SYMBOL_ENTRY"
      },
      "literal_runtime_registration_present": false
    },
    {
      "forensic_id": "MG-005",
      "gate_id": "enumeration.graph_health",
      "activation_id": "enumeration.graph_health.accepted_depth",
      "owning_seam": "POST_DISCOVERY",
      "applicability": {
        "pipelines": [
          "L1",
          "SC"
        ],
        "modes": [
          "CORE",
          "LIGHT",
          "THOROUGH"
        ],
        "ecosystems": [
          "APTOS",
          "DAML",
          "EVM",
          "L1_GO",
          "L1_RUST",
          "SOLANA",
          "SOROBAN",
          "SUI"
        ],
        "backends": [
          "CLAUDE",
          "CODEX"
        ],
        "phase_contexts": [
          "DEPTH"
        ],
        "status": "FORENSIC_EXACT"
      },
      "definitions": [
        {
          "module": "scripts/enumeration_gate.py",
          "symbol": "_graph_health_shortfalls",
          "source_line": 530
        },
        {
          "module": "scripts/enumeration_gate.py",
          "symbol": "_record_graph_health",
          "source_line": 666
        }
      ],
      "observed_callsites": [
        {
          "module": "scripts/enumeration_gate.py",
          "enclosing_symbol": "compute_enumeration_obligations",
          "call_symbol": "_record_graph_health",
          "source_line": 769
        },
        {
          "module": "scripts/enumeration_gate.py",
          "enclosing_symbol": "compute_enumeration_obligations",
          "call_symbol": "_record_graph_health",
          "source_line": 792
        },
        {